{
  "binding_scope": "CASE_SPECIFIC",
  "candidate_output": {
    "claims": [],
    "diagnostics": [],
    "mapping_summary": {
      "insufficient_count": 0,
      "mapped_relation_count": 1,
      "partial_count": 0,
      "sufficient_count": 1,
      "uncertain_count": 0
    },
    "opportunities": [
      {
        "abstention_reason": null,
        "activity_priority": 0.9,
        "allowed_anchor_structures": [
          "SINGLE_FRAGMENT"
        ],
        "allowed_response_formats": [
          "OPEN_SHORT"
        ],
        "cognitive_operation": "INTERPRET_REPRESENTATION",
        "difficulty": "MEDIUM",
        "dimension_id": "dimension_p06_route_5bb3220dc4fe8eed228c",
        "evidence_fit": 1.0,
        "evidence_ids": [
          "ev_0b02c8cd484538b07e38"
        ],
        "focus": "Examinar relación entre afirmación y evidencia: encabezado usando exclusivamente la evidencia localizada y el alcance autorizado de la actividad.",
        "observable": "Relaciona una afirmación con evidencia localizada sin ampliar fuentes ni atribuir intención.",
        "opportunity_id": "opportunity_82be3f8a56cf34027fbd",
        "opportunity_quality": 0.75,
        "opportunity_template_id": "template_p06_route_5bb3220dc4fe8eed228c",
        "semantic_uncertainty": null,
        "student_justification_required": true,
        "submission_id": "submission_03",
        "support_description": "E3 presenta los valores de los dos grupos y los vincula explícitamente con la afirmación de que el primer conjunto apoya la hipótesis.",
        "support_status": "SUFFICIENT",
        "support_type": "DIRECT",
        "target_minutes": 5,
        "variant_id": "variant_p06_route_5bb3220dc4fe8eed228c"
      }
    ],
    "schema_version": "1.1.0",
    "status": "READY",
    "submission_id": "submission_03",
    "variant_matches": [
      {
        "dimension_id": "dimension_p06_route_5bb3220dc4fe8eed228c",
        "evidence_fit": 1.0,
        "evidence_ids": [
          "ev_0b02c8cd484538b07e38"
        ],
        "justification": "Relaciones categóricas P06 materializadas por el servidor.",
        "mapping_confidence": 1.0,
        "support_status": "SUFFICIENT",
        "variant_id": "variant_p06_route_5bb3220dc4fe8eed228c"
      }
    ]
  },
  "candidate_output_hash": "sha256:3c60fd52af6871b065c8c7736815ae35711e58500600051d3a10980713d55ce2",
  "case_id": "PP-A01-S03-P06-R01",
  "defensible_alternatives": [],
  "fixture_id": "P06-A01-S03-R01",
  "oracle_state": "VALID",
  "property": {
    "benchmark_tags": [],
    "confidence": "HIGH",
    "defensible_alternatives": [],
    "description": "INSUFFICIENT para 'Variables y medidas': el documento declara la altura como variable independiente y las horas como dependiente, y lo repite en la sección de análisis. La relación superficial con el vocabulario correcto no alcanza.",
    "kind": "REQUIRED",
    "notes": "",
    "oracle_state": "VALID",
    "property_id": "A01-S03-P1",
    "source_refs": [
      {
        "file": "submissions/submission_03.txt",
        "section": "encabezado"
      },
      {
        "file": "submissions/submission_03.txt",
        "section": "Análisis de variables"
      }
    ],
    "stage": "P06"
  },
  "relevant_source_refs": [
    {
      "file": "submissions/submission_03.txt",
      "section": "encabezado"
    },
    {
      "file": "submissions/submission_03.txt",
      "section": "Análisis de variables"
    }
  ],
  "route_or_opportunity_id": "P06-A01-S03-R01",
  "schema_version": "semantic-review-packet/1.1.0",
  "source_hashes": {
    "submissions/submission_03.txt": "sha256:e540430e88c8717e75fe6f70348ee5a141edc21dffbbd629b761381351a4fba1"
  },
  "stage": "P06"
}
