{
  "binding_scope": "ACTIVITY_WIDE",
  "candidate_output": {
    "claims": [],
    "diagnostics": [],
    "mapping_summary": {
      "insufficient_count": 0,
      "mapped_relation_count": 1,
      "partial_count": 1,
      "sufficient_count": 0,
      "uncertain_count": 0
    },
    "opportunities": [
      {
        "abstention_reason": null,
        "activity_priority": 0.9,
        "allowed_anchor_structures": [
          "SINGLE_FRAGMENT"
        ],
        "allowed_response_formats": [
          "OPEN_SHORT"
        ],
        "cognitive_operation": "INTERPRET_REPRESENTATION",
        "difficulty": "MEDIUM",
        "dimension_id": "dimension_p06_route_216714b2043ff1249014",
        "evidence_fit": 0.5,
        "evidence_ids": [
          "ev_4f1b7e369a62348daf24",
          "ev_5eb56778d9b553f69d72"
        ],
        "focus": "Examinar relación entre afirmación y evidencia: párrafo final usando exclusivamente la evidencia localizada y el alcance autorizado de la actividad.",
        "observable": "Relaciona una afirmación con evidencia localizada sin ampliar fuentes ni atribuir intención.",
        "opportunity_id": "opportunity_91a64c01b525e526dded",
        "opportunity_quality": 0.75,
        "opportunity_template_id": "template_p06_route_216714b2043ff1249014",
        "semantic_uncertainty": "No queda claro qué afirmación pretende respaldar la observación de E2.",
        "student_justification_required": true,
        "submission_id": "submission_01",
        "support_description": "E1 presenta afirmaciones generales sobre la fotosíntesis y E2 registra que los plantines crecieron diferente, pero no explicita la relación entre una afirmación y esa evidencia localizada.",
        "support_status": "PARTIAL",
        "support_type": "COMPOSITE",
        "target_minutes": 5,
        "variant_id": "variant_p06_route_216714b2043ff1249014"
      }
    ],
    "schema_version": "1.1.0",
    "status": "READY",
    "submission_id": "submission_01",
    "variant_matches": [
      {
        "dimension_id": "dimension_p06_route_216714b2043ff1249014",
        "evidence_fit": 0.5,
        "evidence_ids": [
          "ev_4f1b7e369a62348daf24",
          "ev_5eb56778d9b553f69d72"
        ],
        "justification": "Relaciones categóricas P06 materializadas por el servidor.",
        "mapping_confidence": 1.0,
        "support_status": "PARTIAL",
        "variant_id": "variant_p06_route_216714b2043ff1249014"
      }
    ]
  },
  "candidate_output_hash": "sha256:d391b505381e2aa9b394f30642779045f171284a77db59fda521b9efde3438ec",
  "case_id": "PP-A01-S01-P06-R01",
  "defensible_alternatives": [],
  "fixture_id": "P06-A01-S01-R01",
  "oracle_state": "VALID",
  "property": {
    "benchmark_tags": [],
    "confidence": "MEDIUM",
    "defensible_alternatives": [],
    "description": "La actividad ofrece los cuatro estados de P06 en distintas entregas: SUFFICIENT (01, 02), PARTIAL (03 evidencia, 04 limitación), INSUFFICIENT (03 variables, 04 evidencia) y UNCERTAIN (06, párrafo final donde el estudiante declara no saber qué grupo es cuál).",
    "kind": "CONTEXTUAL_NOTE",
    "notes": "",
    "oracle_state": "VALID",
    "property_id": "A01-ACT-P5",
    "source_refs": [
      {
        "file": "submissions/submission_01.txt",
        "section": "párrafo final"
      }
    ],
    "stage": "P06"
  },
  "relevant_source_refs": [
    {
      "file": "submissions/submission_01.txt",
      "section": "párrafo final"
    }
  ],
  "route_or_opportunity_id": "P06-A01-S01-R01",
  "schema_version": "semantic-review-packet/1.1.0",
  "source_hashes": {
    "submissions/submission_01.txt": "sha256:f33aa63575b544d7f03e070ad8a2aa3936f4e76d7ebf98922404efa5442818d5"
  },
  "stage": "P06"
}
