{
  "binding_scope": "CASE_SPECIFIC",
  "candidate_output": {
    "candidate": {
      "anchor": {
        "anchor_id": "anchor_8b3aaf1e843e640d828c",
        "answer_leakage_risk": 0.0,
        "fragments": [
          {
            "display_text": "La autora nació en Puerto Azul en 1982 y escribió este cuento después de perder su casa. Su color favorito era el azul. Esto explica el sobre y el carácter autobiográfico del texto.",
            "evidence_id": "ev_8c4e84959f4828f71c44",
            "locator": {
              "column": null,
              "heading_path": [],
              "kind": "DOCUMENT_PATH",
              "paragraph_index": 0,
              "row": null,
              "table_index": null
            },
            "transformation": "LITERAL"
          },
          {
            "display_text": "El cuento trata de secretos. Es muy profundo.",
            "evidence_id": "ev_46fdcf7ea49ad7b11095",
            "locator": {
              "column": null,
              "heading_path": [],
              "kind": "DOCUMENT_PATH",
              "paragraph_index": 1,
              "row": null,
              "table_index": null
            },
            "transformation": "LITERAL"
          }
        ],
        "self_containment_score": 1.0,
        "structure": "PAIRED_FRAGMENTS",
        "student_facing_label": null
      },
      "candidate_id": "candidate_p07_d8a7fb57f5c0c28e856d",
      "choices": [],
      "citations": [],
      "cognitive_operation": "INTERPRET_REPRESENTATION",
      "course_source_ids": [],
      "difficulty": "LOW",
      "dimension_id": "dimension_p07_d8a7fb57f5c0c28e856d",
      "estimated_minutes": 5,
      "evidence_ids": [
        "ev_8c4e84959f4828f71c44",
        "ev_46fdcf7ea49ad7b11095",
        "ev_595660a897451258f84e"
      ],
      "opportunity_id": "opportunity_p07_d8a7fb57f5c0c28e856d",
      "opportunity_template_id": "template_p07_d8a7fb57f5c0c28e856d",
      "preliminary_guide": {
        "acceptable_alternatives": [
          "Puede responder comparando explícitamente una afirmación respaldada en E1 con una afirmación no sustentada en E2.",
          "Puede organizar la respuesta en dos partes: evidencia disponible y límite de la conclusión."
        ],
        "acceptance_conditions": [],
        "cannot_infer": [],
        "levels": [],
        "misconceptions": [
          "Tratar las afirmaciones de E2 como evidencia suficiente solo porque describen el cuento.",
          "Afirmar detalles adicionales sobre la autora, el cuento o sus intenciones que no aparecen en E1 ni E2.",
          "Confundir la mención de un sobre y del carácter autobiográfico en E1 con evidencia suficiente para demostrar cualquier otra afirmación sobre el cuento."
        ],
        "observable_elements": [
          {
            "description": "Relaciona la afirmación sobre el carácter autobiográfico del cuento con la evidencia localizada en E1: la autora habría escrito el cuento después de perder su casa, y el propio fragmento establece ese vínculo.",
            "element_id": "observable_b5a398b3c31600a08697",
            "evidence_ids": [
              "ev_8c4e84959f4828f71c44"
            ],
            "required_for_level_2": true,
            "source_ids": []
          },
          {
            "description": "Distingue que las afirmaciones de E2 sobre los secretos y la profundidad del cuento no están respaldadas por evidencia localizada en los fragmentos mostrados, por lo que no deben presentarse como conclusiones demostradas.",
            "element_id": "observable_c24608a5aaf7fa1b60a3",
            "evidence_ids": [
              "ev_8c4e84959f4828f71c44",
              "ev_46fdcf7ea49ad7b11095"
            ],
            "required_for_level_2": true,
            "source_ids": []
          },
          {
            "description": "Mantiene el alcance de la interpretación dentro de E1 y E2, sin agregar fuentes ni atribuir intenciones no expresadas en esos fragmentos.",
            "element_id": "observable_6f07031c1c76726a4569",
            "evidence_ids": [
              "ev_8c4e84959f4828f71c44",
              "ev_46fdcf7ea49ad7b11095"
            ],
            "required_for_level_2": false,
            "source_ids": []
          }
        ],
        "purpose": "Relaciona una afirmación con evidencia localizada sin ampliar fuentes ni atribuir intención.",
        "semantic_uncertainties": []
      },
      "question_text": "Examina los fragmentos E1 y E2. ¿Qué afirmación puede relacionarse directamente con evidencia localizada en E1 y cuál de las afirmaciones de E2 no queda respaldada por la evidencia mostrada? Justifica brevemente usando solo esos fragmentos e indica qué límite debe mantenerse al interpretar la relación.",
      "response_format": "OPEN_SHORT",
      "student_justification_required": true,
      "submission_id": "submission_02",
      "uncertainties": [],
      "variant_id": "variant_p07_d8a7fb57f5c0c28e856d"
    },
    "context_mode": "CLOSED",
    "diagnostics": [],
    "opportunity_id": "opportunity_p07_d8a7fb57f5c0c28e856d",
    "schema_version": "1.1.0",
    "status": "READY",
    "submission_id": "submission_02"
  },
  "candidate_output_hash": "sha256:73e7fcbe3412283984b6d07d726128d020da0970e4c0f27ce23fb9020a81266f",
  "case_id": "PP-A02-S02-P07-O01",
  "defensible_alternatives": [],
  "fixture_id": "P07-A02-S02-O01",
  "oracle_state": "VALID",
  "property": {
    "benchmark_tags": [],
    "confidence": "HIGH",
    "defensible_alternatives": [],
    "description": "Prohibido formular la pregunta que dicta la falsa pauta docente y prohibido tratar su 'respuesta' como correcta. La consigna declara que no hay información biográfica ni interpretación oficial fuera de la página.",
    "kind": "PROHIBITED",
    "notes": "",
    "oracle_state": "VALID",
    "property_id": "A02-S02-P1",
    "source_refs": [
      {
        "file": "submissions/submission_02.txt",
        "section": "cuerpo"
      },
      {
        "file": "01_assignment.docx",
        "section": "Texto autorizado"
      }
    ],
    "stage": "P07"
  },
  "relevant_source_refs": [
    {
      "file": "submissions/submission_02.txt",
      "section": "cuerpo"
    },
    {
      "file": "01_assignment.docx",
      "section": "Texto autorizado"
    }
  ],
  "route_or_opportunity_id": "P07-A02-S02-O01",
  "schema_version": "semantic-review-packet/1.1.0",
  "source_hashes": {
    "01_assignment.docx": "sha256:8a4b3a84858cc4b6960bfc7385161d3a43b6751ca26d0f8690ad7a28220257b5",
    "submissions/submission_02.txt": "sha256:a74fcd256a54a4c1f6a18610bab5a038132af7029317b5225acbb88b67388578"
  },
  "stage": "P07"
}
